{
  "$schema": "schemas/provider-capability-matrix.schema.json",
  "schema_version": "provider-capability-matrix.v1",
  "matrix_id": "phase-08-provider-capabilities@1",
  "capability_registry_ref": "phase-08-eventing-capabilities@1",
  "bundle_selections": [
    {
      "bundle_id": "bundle.aws.embedded@1",
      "provider": "aws",
      "profile_scope": "embedded",
      "members": ["AWS IoT Core", "AWS Lambda", "AWS Step Functions Standard", "AWS IoT Commands", "Amazon CloudWatch"],
      "decision": "selected",
      "implementation_status": "planned_phase_8_9"
    },
    {
      "bundle_id": "bundle.azure.embedded@1",
      "provider": "azure",
      "profile_scope": "embedded",
      "members": ["Azure IoT Hub", "Azure Functions Flex Consumption", "Azure Logic Apps Consumption", "Azure Monitor"],
      "decision": "selected",
      "implementation_status": "planned_phase_8_9"
    },
    {
      "bundle_id": "bundle.gcp.embedded@1",
      "provider": "gcp",
      "profile_scope": "embedded",
      "members": ["Google Cloud Pub/Sub", "Google Cloud Run", "Google Cloud Workflows", "GKE Standard", "Apache BifroMQ 4.0.0-incubating", "Google Cloud Logging"],
      "decision": "selected",
      "implementation_status": "planned_phase_8_9"
    },
    {
      "bundle_id": "bundle.aws.event-layer@1",
      "provider": "aws",
      "profile_scope": "event_layer",
      "members": ["Amazon Kinesis Data Streams", "Amazon SNS FIFO", "Amazon SQS FIFO", "AWS Lambda", "Amazon CloudWatch"],
      "decision": "selected",
      "implementation_status": "planned_phase_8_9"
    },
    {
      "bundle_id": "bundle.azure.event-layer@1",
      "provider": "azure",
      "profile_scope": "event_layer",
      "members": ["Azure Event Hubs Standard", "Azure Service Bus Standard", "Azure Functions Flex Consumption", "Azure Monitor"],
      "decision": "selected",
      "implementation_status": "planned_phase_8_9"
    },
    {
      "bundle_id": "bundle.gcp.event-layer@1",
      "provider": "gcp",
      "profile_scope": "event_layer",
      "members": ["Google Cloud Pub/Sub", "Google Cloud Run services", "Google Cloud Run worker pools", "Google Cloud Logging"],
      "decision": "selected",
      "implementation_status": "planned_phase_8_9"
    }
  ],
  "capability_rows": [
    {
      "capability_id": "capability.domain.rule-evaluation",
      "profile_scope": "embedded",
      "cells": [
        {"provider": "aws", "status": "native", "responsible_members": ["AWS Lambda"], "source_ids": ["source.aws.lambda.pricing-api.2026-07-20"], "limitation": "Regional concurrency must be preflighted.", "implementation_status": "planned_phase_8_9"},
        {"provider": "azure", "status": "native", "responsible_members": ["Azure Functions Flex Consumption"], "source_ids": ["source.azure.functions-flex.retail-api.2026-07-20"], "limitation": "Regional subscription memory must be preflighted.", "implementation_status": "planned_phase_8_9"},
        {"provider": "gcp", "status": "native", "responsible_members": ["Google Cloud Run"], "source_ids": ["source.gcp.cloud-run.pricing.2026-07-20"], "limitation": "The 0.167-vCPU/256-MiB request-based function shape requires concurrency one.", "implementation_status": "planned_phase_8_9"}
      ]
    },
    {
      "capability_id": "capability.domain.extension-action",
      "profile_scope": "embedded",
      "cells": [
        {"provider": "aws", "status": "native", "responsible_members": ["AWS Lambda"], "source_ids": ["source.aws.lambda.pricing-api.2026-07-20"], "limitation": "User extension remains bounded by the reviewed extension contract.", "implementation_status": "planned_phase_8_9"},
        {"provider": "azure", "status": "native", "responsible_members": ["Azure Functions Flex Consumption"], "source_ids": ["source.azure.functions-flex.retail-api.2026-07-20"], "limitation": "User extension remains bounded by the reviewed extension contract.", "implementation_status": "planned_phase_8_9"},
        {"provider": "gcp", "status": "native", "responsible_members": ["Google Cloud Run"], "source_ids": ["source.gcp.cloud-run.pricing.2026-07-20"], "limitation": "User extension remains bounded by the reviewed extension contract.", "implementation_status": "planned_phase_8_9"}
      ]
    },
    {
      "capability_id": "capability.domain.stateful-notification",
      "profile_scope": "embedded",
      "cells": [
        {"provider": "aws", "status": "native", "responsible_members": ["AWS Step Functions Standard"], "source_ids": ["source.aws.step-functions.pricing-api.2026-07-20"], "limitation": "One external notification integration is still an application-owned destination.", "implementation_status": "planned_phase_8_9"},
        {"provider": "azure", "status": "native", "responsible_members": ["Azure Logic Apps Consumption"], "source_ids": ["source.azure.logic-apps.retail-api.2026-07-20"], "limitation": "One Standard Connector call is billed separately.", "implementation_status": "planned_phase_8_9"},
        {"provider": "gcp", "status": "native", "responsible_members": ["Google Cloud Workflows"], "source_ids": ["source.gcp.workflows.pricing.2026-07-20"], "limitation": "External notification steps use the external-step meter.", "implementation_status": "planned_phase_8_9"}
      ]
    },
    {
      "capability_id": "capability.domain.device-command-feedback",
      "profile_scope": "embedded",
      "cells": [
        {"provider": "aws", "status": "native", "responsible_members": ["AWS IoT Commands"], "source_ids": ["source.aws.iot-commands.pricing-api.2026-07-20"], "limitation": "IoT messaging is charged in addition to command execution.", "implementation_status": "planned_phase_8_9"},
        {"provider": "azure", "status": "native", "responsible_members": ["Azure IoT Hub"], "source_ids": ["source.azure.iot-hub.quotas.2026-07-20"], "limitation": "Cloud-to-device queue TTL and device acknowledgement must be explicit.", "implementation_status": "planned_phase_8_9"},
        {"provider": "gcp", "status": "platform_adapter", "responsible_members": ["Google Cloud Pub/Sub", "Apache BifroMQ 4.0.0-incubating", "GKE Standard"], "source_ids": ["source.gcp.mqtt-architecture.2026-07-20", "source.gcp.bifromq.2026-07-20"], "limitation": "Pub/Sub, not the MQTT session, owns durable command acknowledgement; Apache incubation is a PoC-only maturity risk.", "implementation_status": "planned_phase_8_9"}
      ]
    },
    {
      "capability_id": "capability.domain.typed-outcomes",
      "profile_scope": "embedded",
      "cells": [
        {"provider": "aws", "status": "composed", "responsible_members": ["AWS Lambda", "AWS Step Functions Standard", "AWS IoT Commands"], "source_ids": ["source.aws.lambda.pricing-api.2026-07-20", "source.aws.iot-commands.pricing-api.2026-07-20"], "limitation": "Outcome schema and correlation are platform contracts.", "implementation_status": "planned_phase_8_9"},
        {"provider": "azure", "status": "composed", "responsible_members": ["Azure Functions Flex Consumption", "Azure Logic Apps Consumption", "Azure IoT Hub"], "source_ids": ["source.azure.functions-flex.retail-api.2026-07-20", "source.azure.logic-apps.retail-api.2026-07-20"], "limitation": "Outcome schema and correlation are platform contracts.", "implementation_status": "planned_phase_8_9"},
        {"provider": "gcp", "status": "composed", "responsible_members": ["Google Cloud Run", "Google Cloud Workflows", "Google Cloud Pub/Sub"], "source_ids": ["source.gcp.cloud-run.pricing.2026-07-20", "source.gcp.workflows.pricing.2026-07-20"], "limitation": "Outcome schema and correlation are platform contracts.", "implementation_status": "planned_phase_8_9"}
      ]
    },
    {
      "capability_id": "capability.direct-edge.bounded-retry",
      "profile_scope": "embedded",
      "cells": [
        {"provider": "aws", "status": "composed", "responsible_members": ["AWS Lambda", "Amazon CloudWatch"], "source_ids": ["source.aws.lambda.pricing-api.2026-07-20", "source.aws.cloudwatch.pricing-api.2026-07-20"], "limitation": "Direct edges do not claim general replay.", "implementation_status": "planned_phase_8_9"},
        {"provider": "azure", "status": "composed", "responsible_members": ["Azure Functions Flex Consumption", "Azure Monitor"], "source_ids": ["source.azure.functions-flex.retail-api.2026-07-20", "source.azure.monitor.retail-api.2026-07-20"], "limitation": "Direct edges do not claim general replay.", "implementation_status": "planned_phase_8_9"},
        {"provider": "gcp", "status": "composed", "responsible_members": ["Google Cloud Run", "Google Cloud Logging"], "source_ids": ["source.gcp.cloud-run.pricing.2026-07-20", "source.gcp.logging.pricing.2026-07-20"], "limitation": "Direct edges do not claim general replay.", "implementation_status": "planned_phase_8_9"}
      ]
    },
    {
      "capability_id": "capability.security.workload-identity",
      "profile_scope": "embedded",
      "cells": [
        {"provider": "aws", "status": "native", "responsible_members": ["AWS IAM"], "source_ids": ["source.aws.web-identity.security.2026-07-20"], "limitation": "Trust conditions remain deployment inputs.", "implementation_status": "planned_phase_8_9"},
        {"provider": "azure", "status": "native", "responsible_members": ["Microsoft Entra workload identity"], "source_ids": ["source.azure.workload-identity-federation.security.2026-07-20"], "limitation": "Trust conditions remain deployment inputs.", "implementation_status": "planned_phase_8_9"},
        {"provider": "gcp", "status": "native", "responsible_members": ["Google Cloud IAM"], "source_ids": ["source.gcp.workload-identity-federation.security.2026-07-20"], "limitation": "Trust conditions remain deployment inputs.", "implementation_status": "planned_phase_8_9"}
      ]
    },
    {
      "capability_id": "capability.device.boundary",
      "profile_scope": "embedded",
      "cells": [